"No.","Time","Source","Destination","Protocol","Length","Info"
"1","0.000000000","192.168.1.53","192.168.1.1","DNS","85","Standard query 0x5a29 A www.google.com OPT"
"2","0.004035592","192.168.1.1","192.168.1.53","DNS","165","Standard query response 0x5a29 A www.google.com A 173.194.44.51 A 173.194.44.50 A 173.194.44.48 A 173.194.44.49 A 173.194.44.52 OPT"
"3","0.235154132","192.168.1.53","173.194.44.51","GQUIC","1392","Client Hello, PKN: 1, CID: 13700519466801831885"
"4","0.235411895","192.168.1.53","173.194.44.51","GQUIC","743","Payload (Encrypted), PKN: 2, CID: 13700519466801831885"
"5","0.280737976","173.194.44.51","192.168.1.53","GQUIC","1392","Payload (Encrypted), PKN: 1, CID: 13700519466801831885"
"6","0.280762616","173.194.44.51","192.168.1.53","GQUIC","81","Payload (Encrypted), PKN: 2, CID: 13700519466801831885"
"7","0.280767715","173.194.44.51","192.168.1.53","GQUIC","70","Payload (Encrypted), PKN: 3, CID: 13700519466801831885"
"8","0.281185533","192.168.1.53","173.194.44.51","GQUIC","83","Payload (Encrypted), PKN: 3, CID: 13700519466801831885"
"9","0.281249873","192.168.1.53","173.194.44.51","GQUIC","70","Payload (Encrypted), PKN: 4, CID: 13700519466801831885"
"10","0.315084437","173.194.44.51","192.168.1.53","GQUIC","397","Payload (Encrypted), PKN: 4, CID: 13700519466801831885"
"11","0.315097438","173.194.44.51","192.168.1.53","GQUIC","69","Payload (Encrypted), PKN: 5, CID: 13700519466801831885"
"12","0.315100450","173.194.44.51","192.168.1.53","GQUIC","185","Payload (Encrypted), PKN: 6, CID: 13700519466801831885"
"13","0.315230111","192.168.1.53","173.194.44.51","GQUIC","70","Payload (Encrypted), PKN: 5, CID: 13700519466801831885"
"14","0.341307918","192.168.1.53","173.194.44.51","GQUIC","70","Payload (Encrypted), PKN: 6, CID: 13700519466801831885"
"15","0.383656673","173.194.44.51","192.168.1.53","GQUIC","70","Payload (Encrypted), PKN: 7, CID: 13700519466801831885"
"16","0.470130242","192.168.1.53","192.168.1.1","DNS","91","Standard query 0x2590 A beacons.gcp.gvt2.com OPT"
"17","0.476627940","192.168.1.1","192.168.1.53","DNS","137","Standard query response 0x2590 A beacons.gcp.gvt2.com CNAME beacons-handoff.gcp.gvt2.com A 64.233.165.94 OPT"
"18","0.486031402","192.168.1.53","64.233.165.94","GQUIC","1392","Client Hello, PKN: 1, CID: 14979532717595937104"
"19","0.535597609","64.233.165.94","192.168.1.53","GQUIC","1392","Payload (Encrypted), PKN: 1"
"20","0.535619774","64.233.165.94","192.168.1.53","GQUIC","73","Payload (Encrypted), PKN: 2"
"21","0.536054615","192.168.1.53","64.233.165.94","GQUIC","81","Payload (Encrypted), PKN: 2, CID: 14979532717595937104"
"22","0.536119059","192.168.1.53","64.233.165.94","GQUIC","70","Payload (Encrypted), PKN: 3, CID: 14979532717595937104"
"23","0.536275316","192.168.1.53","64.233.165.94","GQUIC","562","Payload (Encrypted), PKN: 4, CID: 14979532717595937104"
"24","0.555271057","64.233.165.94","192.168.1.53","GQUIC","62","Payload (Encrypted), PKN: 3"
"25","0.573596008","64.233.165.94","192.168.1.53","GQUIC","62","Payload (Encrypted), PKN: 4"
"26","0.574441781","64.233.165.94","192.168.1.53","GQUIC","942","Payload (Encrypted), PKN: 5"
"27","0.574454279","64.233.165.94","192.168.1.53","GQUIC","58","Payload (Encrypted), PKN: 6"
"28","0.574608520","192.168.1.53","64.233.165.94","GQUIC","70","Payload (Encrypted), PKN: 5, CID: 14979532717595937104"
"29","4.037168972","192.168.1.53","192.168.1.1","DNS","86","Standard query 0x6529 A www.youtube.com OPT"
"30","4.043830287","192.168.1.1","192.168.1.53","DNS","163","Standard query response 0x6529 A www.youtube.com CNAME youtube-ui.l.google.com CNAME wide-youtube.l.google.com A 64.233.165.198 OPT"
"31","4.046662859","192.168.1.53","64.233.165.198","GQUIC","1392","Client Hello, PKN: 1, CID: 13624842556535870966"
"32","4.091643578","64.233.165.198","192.168.1.53","GQUIC","1392","Payload (Encrypted), PKN: 1"
"33","4.091673318","64.233.165.198","192.168.1.53","GQUIC","73","Payload (Encrypted), PKN: 2"
"34","4.092175347","192.168.1.53","64.233.165.198","GQUIC","81","Payload (Encrypted), PKN: 2, CID: 13624842556535870966"
"35","4.092255409","192.168.1.53","64.233.165.198","GQUIC","70","Payload (Encrypted), PKN: 3, CID: 13624842556535870966"
"36","4.092585488","192.168.1.53","64.233.165.198","GQUIC","1165","Payload (Encrypted), PKN: 4, CID: 13624842556535870966"
"37","4.117953427","64.233.165.198","192.168.1.53","GQUIC","62","Payload (Encrypted), PKN: 3"
"38","4.142110145","64.233.165.198","192.168.1.53","GQUIC","62","Payload (Encrypted), PKN: 4"
"39","4.142132913","64.233.165.198","192.168.1.53","GQUIC","350","Payload (Encrypted), PKN: 5"
"40","4.142889329","64.233.165.198","192.168.1.53","GQUIC","58","Payload (Encrypted), PKN: 6"
"41","4.143098841","192.168.1.53","64.233.165.198","GQUIC","70","Payload (Encrypted), PKN: 5, CID: 13624842556535870966"
"42","4.521404280","192.168.1.53","95.30.216.175","TCP","66","45382  >  443 [ACK] Seq=1 Ack=1 Win=318 Len=0 TSval=569362575 TSecr=2477668809"
"43","4.527513639","95.30.216.175","192.168.1.53","TCP","66","[TCP ACKed unseen segment] 443  >  45382 [ACK] Seq=1 Ack=2 Win=261 Len=0 TSval=2477713866 TSecr=569181738"
"44","5.005509781","D-LinkIn_11:1a:74","LiteonTe_5a:c1:b2","ARP","42","Who has 192.168.1.53? Tell 192.168.1.1"
"45","5.005562025","LiteonTe_5a:c1:b2","D-LinkIn_11:1a:74","ARP","42","192.168.1.53 is at 48:d2:24:5a:c1:b2"
"46","10.940670238","192.168.1.53","64.233.165.198","GQUIC","871","Payload (Encrypted), PKN: 6, CID: 13624842556535870966"
"47","10.995410403","64.233.165.198","192.168.1.53","GQUIC","225","Payload (Encrypted), PKN: 7"
"48","10.995436680","64.233.165.198","192.168.1.53","GQUIC","119","Payload (Encrypted), PKN: 8"
"49","10.995715035","192.168.1.53","64.233.165.198","GQUIC","70","Payload (Encrypted), PKN: 7, CID: 13624842556535870966"
"50","12.944604227","192.168.1.53","239.255.255.250","SSDP","213","M-SEARCH * HTTP/1.1 "
"51","13.945641656","192.168.1.53","239.255.255.250","SSDP","213","M-SEARCH * HTTP/1.1 "
"52","14.045677028","192.168.1.53","64.233.165.198","GQUIC","846","Payload (Encrypted), PKN: 8, CID: 13624842556535870966"
"53","14.099476764","64.233.165.198","192.168.1.53","GQUIC","112","Payload (Encrypted), PKN: 9"
"54","14.099500417","64.233.165.198","192.168.1.53","GQUIC","58","Payload (Encrypted), PKN: 10"
"55","14.099878907","192.168.1.53","64.233.165.198","GQUIC","70","Payload (Encrypted), PKN: 9, CID: 13624842556535870966"
"56","14.946461864","192.168.1.53","239.255.255.250","SSDP","213","M-SEARCH * HTTP/1.1 "
"57","15.537085888","192.168.1.53","64.233.165.94","GQUIC","65","Payload (Encrypted), PKN: 6, CID: 14979532717595937104"
"58","15.599078924","64.233.165.94","192.168.1.53","GQUIC","62","Payload (Encrypted), PKN: 7"
"59","15.902018900","192.168.1.53","173.194.44.51","GQUIC","197","Payload (Encrypted), PKN: 7, CID: 13700519466801831885"
"60","15.904146539","192.168.1.53","173.194.44.51","GQUIC","81","Payload (Encrypted), PKN: 8, CID: 13700519466801831885"
"61","15.946609779","192.168.1.53","239.255.255.250","SSDP","213","M-SEARCH * HTTP/1.1 "
"62","15.950209561","173.194.44.51","192.168.1.53","GQUIC","87","Payload (Encrypted), PKN: 8, CID: 13700519466801831885"
"63","15.975477490","192.168.1.53","173.194.44.51","GQUIC","70","Payload (Encrypted), PKN: 9, CID: 13700519466801831885"
"64","16.045410781","LiteonTe_5a:c1:b2","D-LinkIn_11:1a:74","ARP","42","Who has 192.168.1.1? Tell 192.168.1.53"
"65","16.046447214","D-LinkIn_11:1a:74","LiteonTe_5a:c1:b2","ARP","42","192.168.1.1 is at 84:c9:b2:11:1a:74"
"66","17.697300960","192.168.1.53","192.168.1.1","DNS","81","Standard query 0xef95 A github.com OPT"
"67","17.697463489","192.168.1.53","192.168.1.1","DNS","94","Standard query 0x6ba0 A github.githubassets.com OPT"
"68","17.697584475","192.168.1.53","192.168.1.1","DNS","101","Standard query 0x591d A avatars1.githubusercontent.com OPT"
"69","17.703432727","192.168.1.1","192.168.1.53","DNS","113","Standard query response 0xef95 A github.com A 140.82.118.3 A 140.82.118.4 OPT"
"70","17.704638959","192.168.1.1","192.168.1.53","DNS","158","Standard query response 0x6ba0 A github.githubassets.com A 185.199.109.154 A 185.199.110.154 A 185.199.108.154 A 185.199.111.154 OPT"
"71","17.705515416","192.168.1.1","192.168.1.53","DNS","152","Standard query response 0x591d A avatars1.githubusercontent.com CNAME github.map.fastly.net A 151.101.36.133 OPT"
"72","17.759050236","192.168.1.53","95.30.216.175","TCP","66","45382  >  443 [RST, ACK] Seq=2 Ack=1 Win=318 Len=0 TSval=569375814 TSecr=2477713866"
"73","17.759150031","192.168.1.53","140.82.118.3","TCP","74","43316  >  443 [SYN] Seq=0 Win=29200 Len=0 MSS=1460 SACK_PERM=1 TSval=1425029959 TSecr=0 WS=128"
"74","17.800561078","192.168.1.53","140.82.118.3","TCP","74","43318  >  443 [SYN] Seq=0 Win=29200 Len=0 MSS=1460 SACK_PERM=1 TSval=1425030000 TSecr=0 WS=128"
"75","17.800791936","192.168.1.53","185.199.109.154","TCP","74","38972  >  443 [SYN] Seq=0 Win=29200 Len=0 MSS=1460 SACK_PERM=1 TSval=3976734041 TSecr=0 WS=128"
"76","17.835076496","140.82.118.3","192.168.1.53","TCP","74","443  >  43316 [SYN, ACK] Seq=0 Ack=1 Win=28480 Len=0 MSS=1436 SACK_PERM=1 TSval=2500332121 TSecr=1425029959 WS=1024"
"77","17.835120426","192.168.1.53","140.82.118.3","TCP","66","43316  >  443 [ACK] Seq=1 Ack=1 Win=29312 Len=0 TSval=1425030035 TSecr=2500332121"
"78","17.835505476","192.168.1.53","140.82.118.3","TLSv1.3","583","Client Hello"
"79","17.879043931","140.82.118.3","192.168.1.53","TCP","74","443  >  43318 [SYN, ACK] Seq=0 Ack=1 Win=28480 Len=0 MSS=1436 SACK_PERM=1 TSval=2500332132 TSecr=1425030000 WS=1024"
"80","17.879132958","192.168.1.53","140.82.118.3","TCP","66","43318  >  443 [ACK] Seq=1 Ack=1 Win=29312 Len=0 TSval=1425030079 TSecr=2500332132"
"81","17.879763347","192.168.1.53","140.82.118.3","TLSv1.3","583","Client Hello"
"82","17.880223737","185.199.109.154","192.168.1.53","TCP","74","443  >  38972 [SYN, ACK] Seq=0 Ack=1 Win=28960 Len=0 MSS=1460 SACK_PERM=1 TSval=2508100192 TSecr=3976734041 WS=512"
"83","17.880281317","192.168.1.53","185.199.109.154","TCP","66","38972  >  443 [ACK] Seq=1 Ack=1 Win=29312 Len=0 TSval=3976734121 TSecr=2508100192"
"84","17.880781103","192.168.1.53","185.199.109.154","TLSv1.2","583","Client Hello"
"85","17.913733444","140.82.118.3","192.168.1.53","TLSv1.3","1474","Server Hello, Change Cipher Spec, Application Data"
"86","17.913861160","192.168.1.53","140.82.118.3","TCP","66","43316  >  443 [ACK] Seq=518 Ack=1409 Win=32128 Len=0 TSval=1425030113 TSecr=2500332141"
"87","17.913979793","140.82.118.3","192.168.1.53","TCP","1474","443  >  43316 [ACK] Seq=1409 Ack=518 Win=29696 Len=1408 TSval=2500332141 TSecr=1425030035 [TCP segment of a reassembled PDU]"
"88","17.914018474","140.82.118.3","192.168.1.53","TLSv1.3","886","Application Data, Application Data, Application Data"
"89","17.914019637","192.168.1.53","140.82.118.3","TCP","66","43316  >  443 [ACK] Seq=518 Ack=2817 Win=35072 Len=0 TSval=1425030114 TSecr=2500332141"
"90","17.914071481","192.168.1.53","140.82.118.3","TCP","66","43316  >  443 [ACK] Seq=518 Ack=3637 Win=37888 Len=0 TSval=1425030114 TSecr=2500332141"
"91","17.959944182","140.82.118.3","192.168.1.53","TLSv1.3","1474","Server Hello, Change Cipher Spec, Application Data"
"92","17.960091179","192.168.1.53","140.82.118.3","TCP","66","43318  >  443 [ACK] Seq=518 Ack=1409 Win=32128 Len=0 TSval=1425030160 TSecr=2500332152"
"93","17.960242710","140.82.118.3","192.168.1.53","TCP","1474","443  >  43318 [ACK] Seq=1409 Ack=518 Win=29696 Len=1408 TSval=2500332152 TSecr=1425030079 [TCP segment of a reassembled PDU]"
"94","17.960280894","192.168.1.53","140.82.118.3","TCP","66","43318  >  443 [ACK] Seq=518 Ack=2817 Win=35072 Len=0 TSval=1425030160 TSecr=2500332152"
"95","17.960327846","140.82.118.3","192.168.1.53","TLSv1.3","886","Application Data, Application Data, Application Data"
"96","17.960350451","192.168.1.53","140.82.118.3","TCP","66","43318  >  443 [ACK] Seq=518 Ack=3637 Win=37888 Len=0 TSval=1425030160 TSecr=2500332152"
"97","17.960365035","185.199.109.154","192.168.1.53","TCP","66","443  >  38972 [ACK] Seq=1 Ack=518 Win=30208 Len=0 TSval=2508100212 TSecr=3976734121"
"98","17.962961379","185.199.109.154","192.168.1.53","TLSv1.2","1474","Server Hello"
"99","17.962981946","192.168.1.53","185.199.109.154","TCP","66","38972  >  443 [ACK] Seq=518 Ack=1409 Win=32128 Len=0 TSval=3976734203 TSecr=2508100213"
"100","17.964564745","185.199.109.154","192.168.1.53","TCP","1474","443  >  38972 [ACK] Seq=1409 Ack=518 Win=30208 Len=1408 TSval=2508100213 TSecr=3976734121 [TCP segment of a reassembled PDU]"
"101","17.964641670","192.168.1.53","185.199.109.154","TCP","66","38972  >  443 [ACK] Seq=518 Ack=2817 Win=35072 Len=0 TSval=3976734205 TSecr=2508100213"
"102","17.964767820","185.199.109.154","192.168.1.53","TLSv1.2","1131","Certificate, Certificate Status, Server Key Exchange, Server Hello Done"
"103","17.964793201","192.168.1.53","185.199.109.154","TCP","66","38972  >  443 [ACK] Seq=518 Ack=3882 Win=37888 Len=0 TSval=3976734205 TSecr=2508100213"
"104","18.548512969","192.168.1.53","192.168.1.1","DNS","88","Standard query 0x3f79 A ocsp.digicert.com OPT"
"105","18.555857425","192.168.1.1","192.168.1.53","DNS","136","Standard query response 0x3f79 A ocsp.digicert.com CNAME cs9.wac.phicdn.net A 93.184.220.29 OPT"
"106","18.556209019","192.168.1.53","93.184.220.29","TCP","74","44906  >  80 [SYN] Seq=0 Win=29200 Len=0 MSS=1460 SACK_PERM=1 TSval=2569073372 TSecr=0 WS=128"
"107","18.589554964","192.168.1.53","185.199.109.154","TLSv1.2","159","Client Key Exchange, Change Cipher Spec, Encrypted Handshake Message"
"108","18.627115432","93.184.220.29","192.168.1.53","TCP","74","80  >  44906 [SYN, ACK] Seq=0 Ack=1 Win=65535 Len=0 MSS=1460 SACK_PERM=1 TSval=3050875959 TSecr=2569073372 WS=512"
"109","18.627167848","192.168.1.53","93.184.220.29","TCP","66","44906  >  80 [ACK] Seq=1 Ack=1 Win=29312 Len=0 TSval=2569073443 TSecr=3050875959"
"110","18.627465935","192.168.1.53","93.184.220.29","HTTP","445","GET /MHEwbzBNMEswSTAJBgUrDgMCGgUABBTfqhLjKLEJQZPin0KCzkdAQpVYowQUsT7DaQP4v0cB1JgmGggC72NkK8MCEAx5qUSwjBGVIJJhX%2BJrHYOiHjAcMBoGCSsGAQUFBzABBAQNMAsGCSsGAQUFBzABAQ%3D%3D HTTP/1.1 "
"111","18.675044908","185.199.109.154","192.168.1.53","TLSv1.2","324","New Session Ticket, Change Cipher Spec, Encrypted Handshake Message"
"112","18.675066090","192.168.1.53","185.199.109.154","TCP","66","38972  >  443 [ACK] Seq=611 Ack=4140 Win=40704 Len=0 TSval=3976734916 TSecr=2508100390"
"113","18.696124647","93.184.220.29","192.168.1.53","TCP","66","80  >  44906 [ACK] Seq=1 Ack=380 Win=145920 Len=0 TSval=3050876030 TSecr=2569073443"
"114","18.697119830","93.184.220.29","192.168.1.53","OCSP","854","Response"
"115","18.697133551","192.168.1.53","93.184.220.29","TCP","66","44906  >  80 [ACK] Seq=380 Ack=789 Win=30848 Len=0 TSval=2569073513 TSecr=3050876031"
"116","18.698482162","192.168.1.53","93.184.220.29","HTTP","447","GET /MHEwbzBNMEswSTAJBgUrDgMCGgUABBRJ9L2KGL92BpjF3kAtaDtxauTmhgQUPdNQpdagre7zSmAKZdMh1Pj41g8CEAoGMEJ%2FW7ztaVc5ZZO2RR%2BiHjAcMBoGCSsGAQUFBzABBAQNMAsGCSsGAQUFBzABAQ%3D%3D HTTP/1.1 "
"117","18.767283770","93.184.220.29","192.168.1.53","OCSP","853","Response"
"118","18.769794029","192.168.1.53","140.82.118.3","TLSv1.3","130","Change Cipher Spec, Application Data"
"119","18.771372688","192.168.1.53","140.82.118.3","TLSv1.3","130","Change Cipher Spec, Application Data"
"120","18.771514693","192.168.1.53","140.82.118.3","TLSv1.3","746","Application Data"
"121","18.809480494","192.168.1.53","93.184.220.29","TCP","66","44906  >  80 [ACK] Seq=761 Ack=1576 Win=32384 Len=0 TSval=2569073625 TSecr=3050876102"
"122","18.849901511","140.82.118.3","192.168.1.53","TLSv1.3","145","Application Data"
"123","18.849994444","192.168.1.53","140.82.118.3","TCP","66","43316  >  443 [ACK] Seq=1262 Ack=3716 Win=37888 Len=0 TSval=1425031049 TSecr=2500332373"
"124","18.850081800","140.82.118.3","192.168.1.53","TLSv1.3","145","Application Data"
"125","18.850095634","192.168.1.53","140.82.118.3","TCP","66","43316  >  443 [ACK] Seq=1262 Ack=3795 Win=37888 Len=0 TSval=1425031050 TSecr=2500332373"
"126","18.850116145","140.82.118.3","192.168.1.53","TLSv1.3","145","Application Data"
"127","18.850138639","192.168.1.53","140.82.118.3","TCP","66","43318  >  443 [ACK] Seq=582 Ack=3716 Win=37888 Len=0 TSval=1425031050 TSecr=2500332374"
"128","18.850160917","140.82.118.3","192.168.1.53","TLSv1.3","145","Application Data"
"129","18.850173952","192.168.1.53","140.82.118.3","TCP","66","43318  >  443 [ACK] Seq=582 Ack=3795 Win=37888 Len=0 TSval=1425031050 TSecr=2500332374"
"130","18.895017394","140.82.118.3","192.168.1.53","TCP","66","443  >  43316 [ACK] Seq=3795 Ack=1262 Win=31744 Len=0 TSval=2500332386 TSecr=1425030971"
"131","19.368321397","140.82.118.3","192.168.1.53","TLSv1.3","1458","Application Data"
"132","19.368346469","192.168.1.53","140.82.118.3","TCP","66","43316  >  443 [ACK] Seq=1262 Ack=5187 Win=40704 Len=0 TSval=1425031568 TSecr=2500332497"
"133","19.368368110","140.82.118.3","192.168.1.53","TLSv1.3","1063","Application Data"
"134","19.368374395","192.168.1.53","140.82.118.3","TCP","66","43316  >  443 [ACK] Seq=1262 Ack=6184 Win=43520 Len=0 TSval=1425031568 TSecr=2500332497"
"135","19.368817082","140.82.118.3","192.168.1.53","TLSv1.3","1458","Application Data"
"136","19.368824174","192.168.1.53","140.82.118.3","TCP","66","43316  >  443 [ACK] Seq=1262 Ack=7576 Win=46464 Len=0 TSval=1425031568 TSecr=2500332497"
"137","19.370523542","140.82.118.3","192.168.1.53","TLSv1.3","1474","Application Data"
"138","19.370531961","192.168.1.53","140.82.118.3","TCP","66","43316  >  443 [ACK] Seq=1262 Ack=8984 Win=49408 Len=0 TSval=1425031570 TSecr=2500332497"
"139","19.370542495","140.82.118.3","192.168.1.53","TLSv1.3","1474","Application Data [TCP segment of a reassembled PDU]"
"140","19.370545265","192.168.1.53","140.82.118.3","TCP","66","43316  >  443 [ACK] Seq=1262 Ack=10392 Win=52224 Len=0 TSval=1425031570 TSecr=2500332497"
"141","19.370550616","140.82.118.3","192.168.1.53","TLSv1.3","1474","Application Data [TCP segment of a reassembled PDU]"
"142","19.370554172","192.168.1.53","140.82.118.3","TCP","66","43316  >  443 [ACK] Seq=1262 Ack=11800 Win=55168 Len=0 TSval=1425031570 TSecr=2500332497"
"143","19.371442676","140.82.118.3","192.168.1.53","TLSv1.3","1474","Application Data [TCP segment of a reassembled PDU]"
"144","19.371451409","192.168.1.53","140.82.118.3","TCP","66","43316  >  443 [ACK] Seq=1262 Ack=13208 Win=58112 Len=0 TSval=1425031571 TSecr=2500332497"
"145","19.371993873","140.82.118.3","192.168.1.53","TLSv1.3","252","Application Data"
"146","19.372001459","192.168.1.53","140.82.118.3","TCP","66","43316  >  443 [ACK] Seq=1262 Ack=13394 Win=60928 Len=0 TSval=1425031572 TSecr=2500332497"
"147","19.375415600","140.82.118.3","192.168.1.53","TLSv1.3","1458","Application Data"
"148","19.375439301","192.168.1.53","140.82.118.3","TCP","66","43316  >  443 [ACK] Seq=1262 Ack=14786 Win=63744 Len=0 TSval=1425031575 TSecr=2500332497"
"149","19.376325485","140.82.118.3","192.168.1.53","TLSv1.3","1474","Application Data"
"150","19.376377804","192.168.1.53","140.82.118.3","TCP","66","43316  >  443 [ACK] Seq=1262 Ack=16194 Win=66688 Len=0 TSval=1425031576 TSecr=2500332497"
"151","19.444344506","140.82.118.3","192.168.1.53","TLSv1.3","1474","Application Data [TCP segment of a reassembled PDU]"
"152","19.444362514","192.168.1.53","140.82.118.3","TCP","66","43316  >  443 [ACK] Seq=1262 Ack=17602 Win=69504 Len=0 TSval=1425031644 TSecr=2500332524"
"153","19.444382701","140.82.118.3","192.168.1.53","TLSv1.3","1474","Application Data [TCP segment of a reassembled PDU]"
"154","19.444387062","192.168.1.53","140.82.118.3","TCP","66","43316  >  443 [ACK] Seq=1262 Ack=19010 Win=72448 Len=0 TSval=1425031644 TSecr=2500332524"
"155","19.450447013","140.82.118.3","192.168.1.53","TLSv1.3","1474","Application Data [TCP segment of a reassembled PDU]"
"156","19.450454020","192.168.1.53","140.82.118.3","TCP","66","43316  >  443 [ACK] Seq=1262 Ack=20418 Win=75392 Len=0 TSval=1425031650 TSecr=2500332525"
"157","19.451661948","140.82.118.3","192.168.1.53","TLSv1.3","1474","Application Data [TCP segment of a reassembled PDU]"
"158","19.451669782","192.168.1.53","140.82.118.3","TCP","66","43316  >  443 [ACK] Seq=1262 Ack=21826 Win=78208 Len=0 TSval=1425031651 TSecr=2500332525"
"159","19.451680005","140.82.118.3","192.168.1.53","TLSv1.3","1474","Application Data [TCP segment of a reassembled PDU]"
"160","19.451684249","192.168.1.53","140.82.118.3","TCP","66","43316  >  443 [ACK] Seq=1262 Ack=23234 Win=81152 Len=0 TSval=1425031651 TSecr=2500332525"
"161","19.451691599","140.82.118.3","192.168.1.53","TLSv1.3","677","Application Data"
"162","19.451695841","192.168.1.53","140.82.118.3","TCP","66","43316  >  443 [ACK] Seq=1262 Ack=23845 Win=83968 Len=0 TSval=1425031651 TSecr=2500332525"
"163","19.663469926","192.168.1.53","185.199.109.154","TCP","74","38976  >  443 [SYN] Seq=0 Win=29200 Len=0 MSS=1460 SACK_PERM=1 TSval=3976735904 TSecr=0 WS=128"
"164","19.688891389","192.168.1.53","151.101.36.133","TCP","74","37416  >  443 [SYN] Seq=0 Win=29200 Len=0 MSS=1460 SACK_PERM=1 TSval=2604310956 TSecr=0 WS=128"
"165","19.727007361","185.199.109.154","192.168.1.53","TCP","74","443  >  38976 [SYN, ACK] Seq=0 Ack=1 Win=28960 Len=0 MSS=1460 SACK_PERM=1 TSval=2508099613 TSecr=3976735904 WS=512"
"166","19.727035677","192.168.1.53","185.199.109.154","TCP","66","38976  >  443 [ACK] Seq=1 Ack=1 Win=29312 Len=0 TSval=3976735968 TSecr=2508099613"
"167","19.727284169","192.168.1.53","185.199.109.154","TLSv1.2","583","Client Hello"
"168","19.759224150","151.101.36.133","192.168.1.53","TCP","74","443  >  37416 [SYN, ACK] Seq=0 Ack=1 Win=28960 Len=0 MSS=1460 SACK_PERM=1 TSval=2508082564 TSecr=2604310956 WS=512"
"169","19.759267384","192.168.1.53","151.101.36.133","TCP","66","37416  >  443 [ACK] Seq=1 Ack=1 Win=29312 Len=0 TSval=2604311027 TSecr=2508082564"
"170","19.759662181","192.168.1.53","151.101.36.133","TLSv1.2","583","Client Hello"
"171","19.790817432","185.199.109.154","192.168.1.53","TCP","66","443  >  38976 [ACK] Seq=1 Ack=518 Win=30208 Len=0 TSval=2508099629 TSecr=3976735968"
"172","19.792322314","185.199.109.154","192.168.1.53","TLSv1.2","1474","Server Hello"
"173","19.792334078","192.168.1.53","185.199.109.154","TCP","66","38976  >  443 [ACK] Seq=518 Ack=1409 Win=32128 Len=0 TSval=3976736033 TSecr=2508099629"
"174","19.792358429","185.199.109.154","192.168.1.53","TCP","1474","443  >  38976 [ACK] Seq=1409 Ack=518 Win=30208 Len=1408 TSval=2508099629 TSecr=3976735968 [TCP segment of a reassembled PDU]"
"175","19.792364127","192.168.1.53","185.199.109.154","TCP","66","38976  >  443 [ACK] Seq=518 Ack=2817 Win=35072 Len=0 TSval=3976736033 TSecr=2508099629"
"176","19.792371875","185.199.109.154","192.168.1.53","TLSv1.2","1131","Certificate, Certificate Status, Server Key Exchange, Server Hello Done"
"177","19.792375913","192.168.1.53","185.199.109.154","TCP","66","38976  >  443 [ACK] Seq=518 Ack=3882 Win=37888 Len=0 TSval=3976736033 TSecr=2508099629"
"178","19.793730538","192.168.1.53","185.199.109.154","TLSv1.2","159","Client Key Exchange, Change Cipher Spec, Encrypted Handshake Message"
"179","19.793936069","192.168.1.53","185.199.109.154","TLSv1.2","159","Application Data"
"180","19.794224990","192.168.1.53","185.199.109.154","TLSv1.2","404","Application Data"
"181","19.794260563","192.168.1.53","185.199.109.154","TLSv1.2","216","Application Data"
"182","19.794490001","192.168.1.53","185.199.109.154","TLSv1.2","426","Application Data, Application Data, Application Data"
"183","19.830119643","151.101.36.133","192.168.1.53","TCP","66","443  >  37416 [ACK] Seq=1 Ack=518 Win=30208 Len=0 TSval=2508082582 TSecr=2604311027"
"184","19.831701373","151.101.36.133","192.168.1.53","TLSv1.2","1474","Server Hello"
"185","19.831734194","192.168.1.53","151.101.36.133","TCP","66","37416  >  443 [ACK] Seq=518 Ack=1409 Win=32128 Len=0 TSval=2604311099 TSecr=2508082582"
"186","19.831771492","151.101.36.133","192.168.1.53","TCP","1474","443  >  37416 [ACK] Seq=1409 Ack=518 Win=30208 Len=1408 TSval=2508082582 TSecr=2604311027 [TCP segment of a reassembled PDU]"
"187","19.831780336","192.168.1.53","151.101.36.133","TCP","66","37416  >  443 [ACK] Seq=518 Ack=2817 Win=35072 Len=0 TSval=2604311099 TSecr=2508082582"
"188","19.831794023","151.101.36.133","192.168.1.53","TLSv1.2","1328","Certificate, Certificate Status, Server Key Exchange, Server Hello Done"
"189","19.831801328","192.168.1.53","151.101.36.133","TCP","66","37416  >  443 [ACK] Seq=518 Ack=4079 Win=37888 Len=0 TSval=2604311099 TSecr=2508082582"
"190","19.840633532","192.168.1.53","151.101.36.133","TLSv1.2","159","Client Key Exchange, Change Cipher Spec, Encrypted Handshake Message"
"191","19.840887922","192.168.1.53","151.101.36.133","TLSv1.2","590","Application Data"
"192","19.857212354","185.199.109.154","192.168.1.53","TCP","66","443  >  38976 [ACK] Seq=3882 Ack=1192 Win=32256 Len=0 TSval=2508099646 TSecr=3976736034"
"193","19.858899566","185.199.109.154","192.168.1.53","TLSv1.2","324","New Session Ticket, Change Cipher Spec, Encrypted Handshake Message"
"194","19.858920420","185.199.109.154","192.168.1.53","TLSv1.2","132","Application Data"
"195","19.858925374","185.199.109.154","192.168.1.53","TLSv1.2","371","Application Data"
"196","19.858929856","185.199.109.154","192.168.1.53","TLSv1.2","569","Application Data"
"197","19.858967830","192.168.1.53","185.199.109.154","TCP","66","38976  >  443 [ACK] Seq=1552 Ack=5014 Win=46336 Len=0 TSval=3976736100 TSecr=2508099646"
"198","19.859731309","192.168.1.53","185.199.109.154","TLSv1.2","104","Application Data"
"199","19.859751202","192.168.1.53","185.199.109.154","TLSv1.2","108","Application Data"
"200","19.859931677","192.168.1.53","185.199.109.154","TLSv1.2","234","Application Data, Application Data, Application Data, Application Data"
"201","19.919242148","151.101.36.133","192.168.1.53","TCP","66","443  >  37416 [ACK] Seq=4079 Ack=1135 Win=31232 Len=0 TSval=2508082604 TSecr=2604311108"
"202","19.919257400","151.101.36.133","192.168.1.53","TLSv1.2","340","New Session Ticket, Change Cipher Spec, Encrypted Handshake Message"
"203","19.919263431","151.101.36.133","192.168.1.53","TLSv1.2","574","Application Data"
"204","19.923085867","185.199.109.154","192.168.1.53","TCP","66","443  >  38976 [ACK] Seq=5014 Ack=1632 Win=33280 Len=0 TSval=2508099662 TSecr=3976736100"
"205","19.961393948","192.168.1.53","151.101.36.133","TCP","66","37416  >  443 [ACK] Seq=1135 Ack=4861 Win=43520 Len=0 TSval=2604311229 TSecr=2508082604"
"206","19.963163829","185.199.109.154","192.168.1.53","TCP","66","443  >  38976 [ACK] Seq=5014 Ack=1800 Win=34816 Len=0 TSval=2508099673 TSecr=3976736101"
"207","20.020589781","192.168.1.53","192.168.1.1","DNS","98","Standard query 0x4dcf A safebrowsing.googleapis.com OPT"
"208","20.026328446","192.168.1.1","192.168.1.53","DNS","114","Standard query response 0x4dcf A safebrowsing.googleapis.com A 173.194.73.95 OPT"
"209","20.028444734","192.168.1.53","173.194.73.95","GQUIC","1392","Client Hello, PKN: 1, CID: 15260842709425950555"
"210","20.029353363","192.168.1.53","173.194.73.95","GQUIC","790","Payload (Encrypted), PKN: 2, CID: 15260842709425950555"
"211","20.058741077","192.168.1.53","192.168.1.1","DNS","101","Standard query 0x26ac A avatars0.githubusercontent.com OPT"
"212","20.059000627","192.168.1.53","192.168.1.1","DNS","101","Standard query 0x452f A avatars2.githubusercontent.com OPT"
"213","20.059487457","192.168.1.53","192.168.1.1","DNS","101","Standard query 0xdd8e A avatars3.githubusercontent.com OPT"
"214","20.064214465","192.168.1.1","192.168.1.53","DNS","152","Standard query response 0x26ac A avatars0.githubusercontent.com CNAME github.map.fastly.net A 151.101.36.133 OPT"
"215","20.064978198","192.168.1.1","192.168.1.53","DNS","152","Standard query response 0x452f A avatars2.githubusercontent.com CNAME github.map.fastly.net A 151.101.36.133 OPT"
"216","20.065275775","192.168.1.53","192.168.1.1","DNS","100","Standard query 0xa731 A github-cloud.s3.amazonaws.com OPT"
"217","20.066123455","192.168.1.53","192.168.1.1","DNS","104","Standard query 0x0222 A user-images.githubusercontent.com OPT"
"218","20.070398755","173.194.73.95","192.168.1.53","GQUIC","1392","Payload (Encrypted), PKN: 1"
"219","20.070428028","173.194.73.95","192.168.1.53","GQUIC","73","Payload (Encrypted), PKN: 2"
"220","20.070760879","192.168.1.53","173.194.73.95","GQUIC","83","Payload (Encrypted), PKN: 3, CID: 15260842709425950555"
"221","20.070820254","192.168.1.53","173.194.73.95","GQUIC","70","Payload (Encrypted), PKN: 4, CID: 15260842709425950555"
"222","20.071575144","173.194.73.95","192.168.1.53","GQUIC","62","Payload (Encrypted), PKN: 3"
"223","20.072315674","192.168.1.1","192.168.1.53","DNS","137","Standard query response 0xa731 A github-cloud.s3.amazonaws.com CNAME s3-1-w.amazonaws.com A 52.216.237.75 OPT"
"224","20.073617160","192.168.1.1","192.168.1.53","DNS","155","Standard query response 0x0222 A user-images.githubusercontent.com CNAME github.map.fastly.net A 151.101.36.133 OPT"
"225","20.075335914","173.194.73.95","192.168.1.53","GQUIC","337","Payload (Encrypted), PKN: 4"
"226","20.075348229","173.194.73.95","192.168.1.53","GQUIC","312","Payload (Encrypted), PKN: 5"
"227","20.075472070","192.168.1.53","173.194.73.95","GQUIC","70","Payload (Encrypted), PKN: 5, CID: 15260842709425950555"
"228","20.138287500","173.194.73.95","192.168.1.53","GQUIC","62","Payload (Encrypted), PKN: 6"
"229","20.139358913","192.168.1.1","192.168.1.53","DNS","152","Standard query response 0xdd8e A avatars3.githubusercontent.com CNAME github.map.fastly.net A 151.101.36.133 OPT"
"230","21.480797529","192.168.1.53","173.194.73.95","GQUIC","650","Payload (Encrypted), PKN: 6, CID: 15260842709425950555"
"231","21.525442835","173.194.73.95","192.168.1.53","GQUIC","199","Payload (Encrypted), PKN: 7"
"232","21.525458936","173.194.73.95","192.168.1.53","GQUIC","116","Payload (Encrypted), PKN: 8"
"233","21.525671557","192.168.1.53","173.194.73.95","GQUIC","70","Payload (Encrypted), PKN: 7, CID: 15260842709425950555"
"234","21.868370536","192.168.1.53","140.82.118.3","TLSv1.3","1090","Application Data"
"235","21.942951490","140.82.118.3","192.168.1.53","TCP","66","443  >  43316 [ACK] Seq=23845 Ack=2286 Win=33792 Len=0 TSval=2500333148 TSecr=1425034068"
"236","21.994003170","192.168.1.53","192.168.1.1","DNS","95","Standard query 0xab5d A www.google-analytics.com OPT"
"237","22.002404031","192.168.1.1","192.168.1.53","DNS","235","Standard query response 0xab5d A www.google-analytics.com CNAME www-google-analytics.l.google.com A 173.194.222.113 A 173.194.222.139 A 173.194.222.101 A 173.194.222.100 A 173.194.222.138 A 173.194.222.102 OPT"
"238","22.005912815","192.168.1.53","173.194.222.102","GQUIC","1392","Client Hello, PKN: 1, CID: 101418421285335142"
"239","22.045683675","192.168.1.53","192.168.1.1","DNS","94","Standard query 0x53e3 A collector.githubapp.com OPT"
"240","22.047208436","173.194.222.102","192.168.1.53","GQUIC","1392","Payload (Encrypted), PKN: 1"
"241","22.047910462","192.168.1.53","173.194.222.102","GQUIC","81","Payload (Encrypted), PKN: 2, CID: 101418421285335142"
"242","22.048112408","173.194.222.102","192.168.1.53","GQUIC","73","Payload (Encrypted), PKN: 2"
"243","22.048130185","192.168.1.53","173.194.222.102","GQUIC","658","Payload (Encrypted), PKN: 3, CID: 101418421285335142"
"244","22.048310929","192.168.1.53","173.194.222.102","GQUIC","467","Payload (Encrypted), PKN: 4, CID: 101418421285335142"
"245","22.052099828","192.168.1.1","192.168.1.53","DNS","209","Standard query response 0x53e3 A collector.githubapp.com CNAME analytics-collector-28944298.us-east-1.elb.amazonaws.com A 34.193.248.191 A 52.20.29.9 A 34.197.57.23 OPT"
"246","22.052455800","192.168.1.53","34.197.57.23","TCP","74","49100  >  443 [SYN] Seq=0 Win=29200 Len=0 MSS=1460 SACK_PERM=1 TSval=2537982677 TSecr=0 WS=128"
"247","22.052493210","192.168.1.53","34.197.57.23","TCP","74","49102  >  443 [SYN] Seq=0 Win=29200 Len=0 MSS=1460 SACK_PERM=1 TSval=2537982677 TSecr=0 WS=128"
"248","22.073653503","173.194.222.102","192.168.1.53","GQUIC","62","Payload (Encrypted), PKN: 3"
"249","22.087676846","173.194.222.102","192.168.1.53","GQUIC","62","Payload (Encrypted), PKN: 4"
"250","22.088162418","173.194.222.102","192.168.1.53","GQUIC","350","Payload (Encrypted), PKN: 5"
"251","22.088901105","173.194.222.102","192.168.1.53","GQUIC","60","Payload (Encrypted), PKN: 6"
"252","22.088950197","173.194.222.102","192.168.1.53","GQUIC","127","Payload (Encrypted), PKN: 7"
"253","22.089687424","173.194.222.102","192.168.1.53","GQUIC","60","Payload (Encrypted), PKN: 8"
"254","22.089939616","192.168.1.53","173.194.222.102","GQUIC","70","Payload (Encrypted), PKN: 5, CID: 101418421285335142"
"255","22.090140322","192.168.1.53","173.194.222.102","GQUIC","70","Payload (Encrypted), PKN: 6, CID: 101418421285335142"
"256","22.213462472","34.197.57.23","192.168.1.53","TCP","74","443  >  49100 [SYN, ACK] Seq=0 Ack=1 Win=28960 Len=0 MSS=1460 SACK_PERM=1 TSval=10949402 TSecr=2537982677 WS=256"
"257","22.213698041","192.168.1.53","34.197.57.23","TCP","66","49100  >  443 [ACK] Seq=1 Ack=1 Win=29312 Len=0 TSval=2537982838 TSecr=10949402"
"258","22.214942204","192.168.1.53","34.197.57.23","TLSv1.2","583","Client Hello"
"259","22.218972190","34.197.57.23","192.168.1.53","TCP","74","443  >  49102 [SYN, ACK] Seq=0 Ack=1 Win=28960 Len=0 MSS=1460 SACK_PERM=1 TSval=10949403 TSecr=2537982677 WS=256"
"260","22.218995077","192.168.1.53","34.197.57.23","TCP","66","49102  >  443 [ACK] Seq=1 Ack=1 Win=29312 Len=0 TSval=2537982844 TSecr=10949403"
"261","22.219244364","192.168.1.53","34.197.57.23","TLSv1.2","583","Client Hello"
"262","22.237166369","140.82.118.3","192.168.1.53","TLSv1.3","1458","Application Data"
"263","22.237198354","192.168.1.53","140.82.118.3","TCP","66","43316  >  443 [ACK] Seq=2286 Ack=25237 Win=86912 Len=0 TSval=1425034437 TSecr=2500333222"
"264","22.238153471","140.82.118.3","192.168.1.53","TLSv1.3","1458","Application Data"
"265","22.238191485","192.168.1.53","140.82.118.3","TCP","66","43316  >  443 [ACK] Seq=2286 Ack=26629 Win=89728 Len=0 TSval=1425034438 TSecr=2500333222"
"266","22.240069038","140.82.118.3","192.168.1.53","TLSv1.3","1231","Application Data"
"267","22.240090770","192.168.1.53","140.82.118.3","TCP","66","43316  >  443 [ACK] Seq=2286 Ack=27794 Win=92544 Len=0 TSval=1425034440 TSecr=2500333222"
"268","22.240118530","140.82.118.3","192.168.1.53","TLSv1.3","93","Application Data"
"269","22.240131700","192.168.1.53","140.82.118.3","TCP","66","43316  >  443 [ACK] Seq=2286 Ack=27821 Win=92544 Len=0 TSval=1425034440 TSecr=2500333222"
"270","22.370979938","34.197.57.23","192.168.1.53","TCP","66","443  >  49100 [ACK] Seq=1 Ack=518 Win=30208 Len=0 TSval=10949442 TSecr=2537982840"
"271","22.376332471","34.197.57.23","192.168.1.53","TLSv1.2","1474","Server Hello"
"272","22.376348237","192.168.1.53","34.197.57.23","TCP","66","49100  >  443 [ACK] Seq=518 Ack=1409 Win=32128 Len=0 TSval=2537983001 TSecr=10949443"
"273","22.376822089","34.197.57.23","192.168.1.53","TCP","1474","443  >  49100 [ACK] Seq=1409 Ack=518 Win=30208 Len=1408 TSval=10949443 TSecr=2537982840 [TCP segment of a reassembled PDU]"
"274","22.376831136","192.168.1.53","34.197.57.23","TCP","66","49100  >  443 [ACK] Seq=518 Ack=2817 Win=35072 Len=0 TSval=2537983002 TSecr=10949443"
"275","22.377634114","34.197.57.23","192.168.1.53","TLSv1.2","801","Certificate, Server Key Exchange, Server Hello Done"
"276","22.377645387","192.168.1.53","34.197.57.23","TCP","66","49100  >  443 [ACK] Seq=518 Ack=3552 Win=37888 Len=0 TSval=2537983002 TSecr=10949443"
"277","22.381940611","192.168.1.53","34.197.57.23","TLSv1.2","192","Client Key Exchange, Change Cipher Spec, Encrypted Handshake Message"
"278","22.386050444","34.197.57.23","192.168.1.53","TCP","66","443  >  49102 [ACK] Seq=1 Ack=518 Win=30208 Len=0 TSval=10949444 TSecr=2537982844"
"279","22.388985190","34.197.57.23","192.168.1.53","TLSv1.2","1474","Server Hello"
"280","22.388996902","192.168.1.53","34.197.57.23","TCP","66","49102  >  443 [ACK] Seq=518 Ack=1409 Win=32128 Len=0 TSval=2537983014 TSecr=10949445"
"281","22.389588897","34.197.57.23","192.168.1.53","TCP","1474","443  >  49102 [ACK] Seq=1409 Ack=518 Win=30208 Len=1408 TSval=10949445 TSecr=2537982844 [TCP segment of a reassembled PDU]"
"282","22.389598270","192.168.1.53","34.197.57.23","TCP","66","49102  >  443 [ACK] Seq=518 Ack=2817 Win=35072 Len=0 TSval=2537983014 TSecr=10949445"
"283","22.390314667","34.197.57.23","192.168.1.53","TLSv1.2","801","Certificate, Server Key Exchange, Server Hello Done"
"284","22.390322821","192.168.1.53","34.197.57.23","TCP","66","49102  >  443 [ACK] Seq=518 Ack=3552 Win=37888 Len=0 TSval=2537983015 TSecr=10949445"
"285","22.392950169","192.168.1.53","34.197.57.23","TLSv1.2","192","Client Key Exchange, Change Cipher Spec, Encrypted Handshake Message"
"286","22.493869497","192.168.1.53","192.168.1.1","DNS","86","Standard query 0x797b A live.github.com OPT"
"287","22.495530243","192.168.1.53","173.194.222.102","GQUIC","390","Payload (Encrypted), PKN: 7, CID: 101418421285335142"
"288","22.497832823","192.168.1.1","192.168.1.53","DNS","118","Standard query response 0x797b A live.github.com A 192.30.253.124 A 192.30.253.125 OPT"
"289","22.500862295","192.168.1.53","192.30.253.124","TCP","74","58094  >  443 [SYN] Seq=0 Win=29200 Len=0 MSS=1460 SACK_PERM=1 TSval=3311721052 TSecr=0 WS=128"
"290","22.535397457","173.194.222.102","192.168.1.53","GQUIC","127","Payload (Encrypted), PKN: 9"
"291","22.535427725","173.194.222.102","192.168.1.53","GQUIC","60","Payload (Encrypted), PKN: 10"
"292","22.536153239","192.168.1.53","173.194.222.102","GQUIC","70","Payload (Encrypted), PKN: 8, CID: 101418421285335142"
"293","22.537325574","34.197.57.23","192.168.1.53","TLSv1.2","117","Change Cipher Spec, Encrypted Handshake Message"
"294","22.537880875","192.168.1.53","34.197.57.23","TLSv1.2","525","Application Data"
"295","22.537967145","192.168.1.53","34.197.57.23","TLSv1.2","441","Application Data"
"296","22.559132526","34.197.57.23","192.168.1.53","TLSv1.2","117","Change Cipher Spec, Encrypted Handshake Message"
"297","22.559780833","192.168.1.53","34.197.57.23","TLSv1.2","525","Application Data"
"298","22.559885909","192.168.1.53","34.197.57.23","TLSv1.2","431","Application Data"
"299","22.608962672","192.168.1.53","34.197.57.23","TCP","74","49106  >  443 [SYN] Seq=0 Win=29200 Len=0 MSS=1460 SACK_PERM=1 TSval=2537983234 TSecr=0 WS=128"
"300","22.624390046","192.168.1.53","192.168.1.1","DNS","85","Standard query 0xb3d5 A api.github.com OPT"
"301","22.631586927","192.168.1.1","192.168.1.53","DNS","117","Standard query response 0xb3d5 A api.github.com A 192.30.253.116 A 192.30.253.117 OPT"
"302","22.631912604","192.168.1.53","192.30.253.116","TCP","74","49988  >  443 [SYN] Seq=0 Win=29200 Len=0 MSS=1460 SACK_PERM=1 TSval=2109706374 TSecr=0 WS=128"
"303","22.671065749","192.30.253.124","192.168.1.53","TCP","74","443  >  58094 [SYN, ACK] Seq=0 Ack=1 Win=28480 Len=0 MSS=1436 SACK_PERM=1 TSval=1060699312 TSecr=3311721052 WS=1024"
"304","22.671100678","192.168.1.53","192.30.253.124","TCP","66","58094  >  443 [ACK] Seq=1 Ack=1 Win=29312 Len=0 TSval=3311721222 TSecr=1060699312"
"305","22.671367600","192.168.1.53","192.30.253.124","TLSv1.3","583","Client Hello"
"306","22.695089193","34.197.57.23","192.168.1.53","TCP","66","443  >  49100 [ACK] Seq=3603 Ack=1478 Win=32256 Len=0 TSval=10949523 TSecr=2537983163"
"307","22.699448049","34.197.57.23","192.168.1.53","TLSv1.2","606","Application Data"
"308","22.701999365","192.168.1.53","34.197.57.23","TLSv1.2","1317","Application Data"
"309","22.726921915","34.197.57.23","192.168.1.53","TCP","66","443  >  49102 [ACK] Seq=3603 Ack=1468 Win=32256 Len=0 TSval=10949530 TSecr=2537983184"
"310","22.731033644","34.197.57.23","192.168.1.53","TLSv1.2","606","Application Data"
"311","22.773411501","192.168.1.53","34.197.57.23","TCP","66","49102  >  443 [ACK] Seq=1468 Ack=4143 Win=40704 Len=0 TSval=2537983398 TSecr=10949530"
"312","22.774469332","34.197.57.23","192.168.1.53","TCP","74","443  >  49106 [SYN, ACK] Seq=0 Ack=1 Win=28960 Len=0 MSS=1460 SACK_PERM=1 TSval=10949541 TSecr=2537983234 WS=256"
"313","22.774500373","192.168.1.53","34.197.57.23","TCP","66","49106  >  443 [ACK] Seq=1 Ack=1 Win=29312 Len=0 TSval=2537983399 TSecr=10949541"
"314","22.774837188","192.168.1.53","34.197.57.23","TLSv1.2","583","Client Hello"
"315","22.786002907","192.30.253.116","192.168.1.53","TCP","74","443  >  49988 [SYN, ACK] Seq=0 Ack=1 Win=28480 Len=0 MSS=1436 SACK_PERM=1 TSval=3099673681 TSecr=2109706374 WS=1024"
"316","22.786028571","192.168.1.53","192.30.253.116","TCP","66","49988  >  443 [ACK] Seq=1 Ack=1 Win=29312 Len=0 TSval=2109706528 TSecr=3099673681"
"317","22.786338026","192.168.1.53","192.30.253.116","TLSv1.3","583","Client Hello"
"318","22.843654063","192.30.253.124","192.168.1.53","TLSv1.3","1474","Server Hello, Change Cipher Spec, Application Data"
"319","22.843704483","192.168.1.53","192.30.253.124","TCP","66","58094  >  443 [ACK] Seq=518 Ack=1409 Win=32128 Len=0 TSval=3311721394 TSecr=1060699356"
"320","22.844696866","192.30.253.124","192.168.1.53","TCP","1474","443  >  58094 [ACK] Seq=1409 Ack=518 Win=29696 Len=1408 TSval=1060699356 TSecr=3311721222 [TCP segment of a reassembled PDU]"
"321","22.844714010","192.168.1.53","192.30.253.124","TCP","66","58094  >  443 [ACK] Seq=518 Ack=2817 Win=35072 Len=0 TSval=3311721395 TSecr=1060699356"
"322","22.844743703","192.30.253.124","192.168.1.53","TLSv1.3","636","Application Data, Application Data, Application Data"
"323","22.844755344","192.168.1.53","192.30.253.124","TCP","66","58094  >  443 [ACK] Seq=518 Ack=3387 Win=37888 Len=0 TSval=3311721395 TSecr=1060699356"
"324","22.849796159","192.168.1.53","192.30.253.124","TLSv1.3","130","Change Cipher Spec, Application Data"
"325","22.850343705","192.168.1.53","192.30.253.124","TLSv1.3","870","Application Data"
"326","22.863205940","34.197.57.23","192.168.1.53","TLSv1.2","624","Application Data"
"327","22.905411604","192.168.1.53","34.197.57.23","TCP","66","49100  >  443 [ACK] Seq=2729 Ack=4701 Win=43520 Len=0 TSval=2537983530 TSecr=10949566"
"328","22.941347492","192.30.253.116","192.168.1.53","TLSv1.3","1474","Server Hello, Change Cipher Spec, Application Data"
"329","22.941385875","192.168.1.53","192.30.253.116","TCP","66","49988  >  443 [ACK] Seq=518 Ack=1409 Win=32128 Len=0 TSval=2109706683 TSecr=3099673721"
"330","22.941409133","192.30.253.116","192.168.1.53","TCP","1474","443  >  49988 [ACK] Seq=1409 Ack=518 Win=29696 Len=1408 TSval=3099673721 TSecr=2109706528 [TCP segment of a reassembled PDU]"
"331","22.941416775","192.168.1.53","192.30.253.116","TCP","66","49988  >  443 [ACK] Seq=518 Ack=2817 Win=35072 Len=0 TSval=2109706683 TSecr=3099673721"
"332","22.941905276","192.30.253.116","192.168.1.53","TLSv1.3","651","Application Data, Application Data, Application Data"
"333","22.941916517","192.168.1.53","192.30.253.116","TCP","66","49988  >  443 [ACK] Seq=518 Ack=3402 Win=37888 Len=0 TSval=2109706684 TSecr=3099673721"
"334","22.943895083","192.168.1.53","192.30.253.116","TLSv1.3","130","Change Cipher Spec, Application Data"
"335","22.944481395","192.168.1.53","192.30.253.116","TLSv1.3","627","Application Data"
"336","22.944666367","192.168.1.53","192.30.253.116","TCP","1490","49988  >  443 [ACK] Seq=1143 Ack=3402 Win=37888 Len=1424 TSval=2109706686 TSecr=3099673721 [TCP segment of a reassembled PDU]"
"337","22.945642595","34.197.57.23","192.168.1.53","TCP","66","443  >  49106 [ACK] Seq=1 Ack=518 Win=30208 Len=0 TSval=10949585 TSecr=2537983400"
"338","22.945656192","34.197.57.23","192.168.1.53","TLSv1.2","211","Server Hello, Change Cipher Spec, Encrypted Handshake Message"
"339","22.945663068","192.168.1.53","34.197.57.23","TCP","66","49106  >  443 [ACK] Seq=518 Ack=146 Win=30336 Len=0 TSval=2537983570 TSecr=10949585"
"340","22.945690705","192.168.1.53","192.30.253.116","TCP","1490","49988  >  443 [ACK] Seq=2567 Ack=3402 Win=37888 Len=1424 TSval=2109706687 TSecr=3099673721 [TCP segment of a reassembled PDU]"
"341","22.946123816","192.168.1.53","192.30.253.116","TCP","1490","49988  >  443 [ACK] Seq=3991 Ack=3402 Win=37888 Len=1424 TSval=2109706688 TSecr=3099673721 [TCP segment of a reassembled PDU]"
"342","22.947464585","2.95.250.46","192.168.1.53","ICMP","590","Destination unreachable (Fragmentation needed)"
"343","22.947492509","192.168.1.53","192.30.253.116","TCP","1474","[TCP Out-Of-Order] 49988  >  443 [ACK] Seq=1143 Ack=3402 Win=37888 Len=1408 TSval=2109706688 TSecr=3099673721"
"344","22.947768478","192.168.1.53","34.197.57.23","TLSv1.2","117","Change Cipher Spec, Encrypted Handshake Message"
"345","22.948408429","192.168.1.53","192.30.253.116","TCP","82","[TCP Out-Of-Order] 49988  >  443 [ACK] Seq=2551 Ack=3402 Win=37888 Len=16 TSval=2109706690 TSecr=3099673721 [TCP segment of a reassembled PDU]"
"346","22.948421276","192.168.1.53","192.30.253.116","TCP","1474","[TCP Out-Of-Order] 49988  >  443 [ACK] Seq=2567 Ack=3402 Win=37888 Len=1408 TSval=2109706690 TSecr=3099673721 [TCP segment of a reassembled PDU]"
"347","22.962343898","2.95.250.46","192.168.1.53","ICMP","590","Destination unreachable (Fragmentation needed)"
"348","22.962365271","2.95.250.46","192.168.1.53","ICMP","590","Destination unreachable (Fragmentation needed)"
"349","22.962435837","192.168.1.53","192.30.253.116","TCP","82","[TCP Out-Of-Order] 49988  >  443 [ACK] Seq=3975 Ack=3402 Win=37888 Len=16 TSval=2109706704 TSecr=3099673721 [TCP segment of a reassembled PDU]"
"350","22.962461586","192.168.1.53","192.30.253.116","TCP","1474","[TCP Out-Of-Order] 49988  >  443 [ACK] Seq=3991 Ack=3402 Win=37888 Len=1408 TSval=2109706704 TSecr=3099673721 [TCP segment of a reassembled PDU]"
"351","22.963555613","192.168.1.53","192.30.253.116","TCP","82","[TCP Retransmission] 49988  >  443 [ACK] Seq=5399 Ack=3402 Win=37888 Len=16 TSval=2109706705 TSecr=3099673721"
"352","22.963694632","192.168.1.53","192.30.253.116","TCP","1474","49988  >  443 [ACK] Seq=5415 Ack=3402 Win=37888 Len=1408 TSval=2109706705 TSecr=3099673721 [TCP segment of a reassembled PDU]"
"353","22.964633240","192.168.1.53","192.30.253.116","TCP","82","49988  >  443 [ACK] Seq=6823 Ack=3402 Win=37888 Len=16 TSval=2109706706 TSecr=3099673721 [TCP segment of a reassembled PDU]"
"354","23.019307046","192.30.253.124","192.168.1.53","TLSv1.3","145","Application Data"
"355","23.019359214","192.30.253.124","192.168.1.53","TLSv1.3","145","Application Data"
"356","23.019373914","192.30.253.124","192.168.1.53","TLSv1.3","293","Application Data"
"357","23.019497372","192.168.1.53","192.30.253.124","TCP","66","58094  >  443 [ACK] Seq=1386 Ack=3772 Win=40704 Len=0 TSval=3311721570 TSecr=1060699399"
"358","23.021225168","192.168.1.53","192.30.253.124","TLSv1.3","133","Application Data"
"359","23.093700193","192.30.253.116","192.168.1.53","TLSv1.3","145","Application Data"
"360","23.093751376","192.168.1.53","192.30.253.116","TCP","1474","49988  >  443 [ACK] Seq=6839 Ack=3481 Win=37888 Len=1408 TSval=2109706835 TSecr=3099673760 [TCP segment of a reassembled PDU]"
"361","23.093793752","192.168.1.53","192.30.253.116","TCP","82","49988  >  443 [ACK] Seq=8247 Ack=3481 Win=37888 Len=16 TSval=2109706835 TSecr=3099673760 [TCP segment of a reassembled PDU]"
"362","23.093810403","192.30.253.116","192.168.1.53","TLSv1.3","145","Application Data"
"363","23.093822418","192.30.253.116","192.168.1.53","TCP","66","443  >  49988 [ACK] Seq=3560 Ack=1143 Win=30720 Len=0 TSval=3099673760 TSecr=2109706686"
"364","23.093834591","192.168.1.53","192.30.253.116","TCP","1474","49988  >  443 [ACK] Seq=8263 Ack=3560 Win=37888 Len=1408 TSval=2109706836 TSecr=3099673760 [TCP segment of a reassembled PDU]"
"365","23.100276702","192.168.1.53","192.30.253.116","TCP","82","49988  >  443 [ACK] Seq=9671 Ack=3560 Win=37888 Len=16 TSval=2109706842 TSecr=3099673760 [TCP segment of a reassembled PDU]"
"366","23.110961015","192.30.253.116","192.168.1.53","TCP","66","443  >  49988 [ACK] Seq=3560 Ack=2551 Win=33792 Len=0 TSval=3099673764 TSecr=2109706688"
"367","23.110994476","192.168.1.53","192.30.253.116","TCP","1474","49988  >  443 [ACK] Seq=9687 Ack=3560 Win=37888 Len=1408 TSval=2109706853 TSecr=3099673764 [TCP segment of a reassembled PDU]"
"368","23.111041818","192.168.1.53","192.30.253.116","TCP","82","49988  >  443 [ACK] Seq=11095 Ack=3560 Win=37888 Len=16 TSval=2109706853 TSecr=3099673764 [TCP segment of a reassembled PDU]"
"369","23.111068269","192.30.253.116","192.168.1.53","TCP","66","443  >  49988 [ACK] Seq=3560 Ack=2567 Win=33792 Len=0 TSval=3099673764 TSecr=2109706690"
"370","23.111087352","192.168.1.53","192.30.253.116","TLSv1.3","270","Application Data"
"371","23.111932872","192.30.253.116","192.168.1.53","TCP","66","443  >  49988 [ACK] Seq=3560 Ack=3975 Win=36864 Len=0 TSval=3099673764 TSecr=2109706690"
"372","23.111955147","192.30.253.116","192.168.1.53","TCP","66","443  >  49988 [ACK] Seq=3560 Ack=3991 Win=36864 Len=0 TSval=3099673764 TSecr=2109706704"
"373","23.112229184","192.30.253.116","192.168.1.53","TCP","66","443  >  49988 [ACK] Seq=3560 Ack=5399 Win=39936 Len=0 TSval=3099673765 TSecr=2109706704"
"374","23.112970432","192.30.253.116","192.168.1.53","TCP","66","443  >  49988 [ACK] Seq=3560 Ack=5415 Win=39936 Len=0 TSval=3099673765 TSecr=2109706705"
"375","23.115021604","192.30.253.116","192.168.1.53","TCP","66","443  >  49988 [ACK] Seq=3560 Ack=6823 Win=41984 Len=0 TSval=3099673765 TSecr=2109706705"
"376","23.115055381","192.30.253.116","192.168.1.53","TCP","66","443  >  49988 [ACK] Seq=3560 Ack=6839 Win=41984 Len=0 TSval=3099673765 TSecr=2109706706"
"377","23.167036383","34.197.57.23","192.168.1.53","TCP","66","443  >  49106 [ACK] Seq=146 Ack=569 Win=30208 Len=0 TSval=10949640 TSecr=2537983572"
"378","23.234969042","192.30.253.124","192.168.1.53","TCP","66","443  >  58094 [ACK] Seq=3772 Ack=1453 Win=31744 Len=0 TSval=1060699454 TSecr=3311721572"
"379","23.242880185","192.30.253.116","192.168.1.53","TCP","66","443  >  49988 [ACK] Seq=3560 Ack=8247 Win=45056 Len=0 TSval=3099673797 TSecr=2109706835"
"380","23.249009101","192.30.253.116","192.168.1.53","TCP","66","443  >  49988 [ACK] Seq=3560 Ack=8263 Win=45056 Len=0 TSval=3099673798 TSecr=2109706835"
"381","23.249025092","192.30.253.116","192.168.1.53","TCP","66","443  >  49988 [ACK] Seq=3560 Ack=9671 Win=48128 Len=0 TSval=3099673799 TSecr=2109706836"
"382","23.249786204","192.30.253.116","192.168.1.53","TCP","66","443  >  49988 [ACK] Seq=3560 Ack=9687 Win=48128 Len=0 TSval=3099673799 TSecr=2109706842"
"383","23.262038433","192.30.253.116","192.168.1.53","TCP","66","443  >  49988 [ACK] Seq=3560 Ack=11095 Win=51200 Len=0 TSval=3099673802 TSecr=2109706853"
"384","23.262063230","192.30.253.116","192.168.1.53","TCP","66","443  >  49988 [ACK] Seq=3560 Ack=11111 Win=51200 Len=0 TSval=3099673802 TSecr=2109706853"
"385","23.262070468","192.30.253.116","192.168.1.53","TCP","66","443  >  49988 [ACK] Seq=3560 Ack=11315 Win=53248 Len=0 TSval=3099673802 TSecr=2109706853"
"386","23.327223333","192.30.253.116","192.168.1.53","TLSv1.3","994","Application Data"
"387","23.369399382","192.168.1.53","192.30.253.116","TCP","66","49988  >  443 [ACK] Seq=11315 Ack=4488 Win=40704 Len=0 TSval=2109707111 TSecr=3099673817"
"388","24.486554600","192.168.1.1","239.193.13.5","IGMPv2","42","Membership Query, specific for group 239.193.13.5"
"389","24.565087227","192.168.1.1","239.193.13.5","IGMPv2","42","Membership Query, specific for group 239.193.13.5"
"390","24.843604307","192.168.1.1","239.193.13.5","IGMPv2","42","Membership Query, specific for group 239.193.13.5"
"391","24.950673796","192.168.1.1","239.193.13.5","IGMPv2","42","Membership Query, specific for group 239.193.13.5"
"392","25.007347780","192.168.1.53","64.233.165.198","GQUIC","789","Payload (Encrypted), PKN: 10, CID: 13624842556535870966"
"393","25.057409935","64.233.165.198","192.168.1.53","GQUIC","112","Payload (Encrypted), PKN: 11"
"394","25.057424509","64.233.165.198","192.168.1.53","GQUIC","58","Payload (Encrypted), PKN: 12"
"395","25.057573356","192.168.1.53","64.233.165.198","GQUIC","70","Payload (Encrypted), PKN: 11, CID: 13624842556535870966"
"396","25.826383356","192.168.1.1","239.193.13.5","IGMPv2","42","Membership Query, specific for group 239.193.13.5"
"397","26.012018070","192.168.1.53","64.233.165.198","GQUIC","649","Payload (Encrypted), PKN: 12, CID: 13624842556535870966"
"398","26.067435970","64.233.165.198","192.168.1.53","GQUIC","164","Payload (Encrypted), PKN: 13"
"399","26.067453685","64.233.165.198","192.168.1.53","GQUIC","295","Payload (Encrypted), PKN: 14"
"400","26.067605454","192.168.1.53","64.233.165.198","GQUIC","70","Payload (Encrypted), PKN: 13, CID: 13624842556535870966"
"401","29.477476148","192.168.1.53","173.194.222.102","GQUIC","462","Payload (Encrypted), PKN: 9, CID: 101418421285335142"
"402","29.478316636","192.168.1.53","140.82.118.3","TCP","66","43318  >  443 [RST, ACK] Seq=582 Ack=3795 Win=37888 Len=0 TSval=1425041678 TSecr=2500332374"
"403","29.478376634","192.168.1.53","185.199.109.154","TCP","66","38972  >  443 [RST, ACK] Seq=611 Ack=4140 Win=40704 Len=0 TSval=3976745719 TSecr=2508100390"
"404","29.478935441","192.168.1.53","34.197.57.23","TLSv1.2","525","Application Data"
"405","29.479007367","192.168.1.53","34.197.57.23","TLSv1.2","443","Application Data"
"406","29.483479045","192.168.1.53","140.82.118.3","TCP","74","43338  >  443 [SYN] Seq=0 Win=29200 Len=0 MSS=1460 SACK_PERM=1 TSval=1425041683 TSecr=0 WS=128"
"407","29.483859373","192.168.1.53","185.199.109.154","TCP","74","38992  >  443 [SYN] Seq=0 Win=29200 Len=0 MSS=1460 SACK_PERM=1 TSval=3976745725 TSecr=0 WS=128"
"408","29.515903478","173.194.222.102","192.168.1.53","GQUIC","150","Payload (Encrypted), PKN: 11"
"409","29.515919265","173.194.222.102","192.168.1.53","GQUIC","60","Payload (Encrypted), PKN: 12"
"410","29.516097018","192.168.1.53","173.194.222.102","GQUIC","70","Payload (Encrypted), PKN: 10, CID: 101418421285335142"
"411","29.540542930","192.168.1.53","140.82.118.3","TLSv1.3","1210","Application Data"
"412","29.548543370","185.199.109.154","192.168.1.53","TCP","74","443  >  38992 [SYN, ACK] Seq=0 Ack=1 Win=28960 Len=0 MSS=1460 SACK_PERM=1 TSval=2508103004 TSecr=3976745725 WS=512"
"413","29.548642268","192.168.1.53","185.199.109.154","TCP","66","38992  >  443 [ACK] Seq=1 Ack=1 Win=29312 Len=0 TSval=3976745790 TSecr=2508103004"
"414","29.549183387","192.168.1.53","185.199.109.154","TLSv1.2","583","Client Hello"
"415","29.567114111","140.82.118.3","192.168.1.53","TCP","74","443  >  43338 [SYN, ACK] Seq=0 Ack=1 Win=28480 Len=0 MSS=1436 SACK_PERM=1 TSval=3493349164 TSecr=1425041683 WS=1024"
"416","29.567152021","192.168.1.53","140.82.118.3","TCP","66","43338  >  443 [ACK] Seq=1 Ack=1 Win=29312 Len=0 TSval=1425041767 TSecr=3493349164"
"417","29.567540805","192.168.1.53","140.82.118.3","TLSv1.3","583","Client Hello"
"418","29.614904009","185.199.109.154","192.168.1.53","TCP","66","443  >  38992 [ACK] Seq=1 Ack=518 Win=30208 Len=0 TSval=2508103020 TSecr=3976745790"
"419","29.618690649","185.199.109.154","192.168.1.53","TLSv1.2","1474","Server Hello"
"420","29.618707362","192.168.1.53","185.199.109.154","TCP","66","38992  >  443 [ACK] Seq=518 Ack=1409 Win=32128 Len=0 TSval=3976745860 TSecr=2508103021"
"421","29.618728917","185.199.109.154","192.168.1.53","TCP","1474","443  >  38992 [ACK] Seq=1409 Ack=518 Win=30208 Len=1408 TSval=2508103021 TSecr=3976745790 [TCP segment of a reassembled PDU]"
"422","29.618734357","192.168.1.53","185.199.109.154","TCP","66","38992  >  443 [ACK] Seq=518 Ack=2817 Win=35072 Len=0 TSval=3976745860 TSecr=2508103021"
"423","29.618741695","185.199.109.154","192.168.1.53","TLSv1.2","1131","Certificate, Certificate Status, Server Key Exchange, Server Hello Done"
"424","29.618745276","192.168.1.53","185.199.109.154","TCP","66","38992  >  443 [ACK] Seq=518 Ack=3882 Win=37888 Len=0 TSval=3976745860 TSecr=2508103021"
"425","29.618752534","140.82.118.3","192.168.1.53","TCP","66","443  >  43316 [ACK] Seq=27821 Ack=3430 Win=35840 Len=0 TSval=2500335067 TSecr=1425041740"
"426","29.620405924","192.168.1.53","185.199.109.154","TLSv1.2","159","Client Key Exchange, Change Cipher Spec, Encrypted Handshake Message"
"427","29.634839800","34.197.57.23","192.168.1.53","TCP","66","443  >  49100 [ACK] Seq=4701 Ack=3565 Win=39936 Len=0 TSval=10951259 TSecr=2537990104"
"428","29.638973649","34.197.57.23","192.168.1.53","TLSv1.2","606","Application Data"
"429","29.638984732","192.168.1.53","34.197.57.23","TCP","66","49100  >  443 [ACK] Seq=3565 Ack=5241 Win=46336 Len=0 TSval=2537990264 TSecr=10951260"
"430","29.651672563","140.82.118.3","192.168.1.53","TLSv1.3","1474","Server Hello, Change Cipher Spec, Application Data"
"431","29.651704578","192.168.1.53","140.82.118.3","TCP","66","43338  >  443 [ACK] Seq=518 Ack=1409 Win=32128 Len=0 TSval=1425041852 TSecr=3493349186"
"432","29.651726909","140.82.118.3","192.168.1.53","TCP","1474","443  >  43338 [ACK] Seq=1409 Ack=518 Win=29696 Len=1408 TSval=3493349186 TSecr=1425041768 [TCP segment of a reassembled PDU]"
"433","29.651734094","192.168.1.53","140.82.118.3","TCP","66","43338  >  443 [ACK] Seq=518 Ack=2817 Win=35072 Len=0 TSval=1425041852 TSecr=3493349186"
"434","29.652211128","140.82.118.3","192.168.1.53","TLSv1.3","886","Application Data, Application Data, Application Data"
"435","29.652218563","192.168.1.53","140.82.118.3","TCP","66","43338  >  443 [ACK] Seq=518 Ack=3637 Win=37888 Len=0 TSval=1425041852 TSecr=3493349186"
"436","29.653690859","192.168.1.53","140.82.118.3","TLSv1.3","130","Change Cipher Spec, Application Data"
"437","29.686877384","185.199.109.154","192.168.1.53","TLSv1.2","324","New Session Ticket, Change Cipher Spec, Encrypted Handshake Message"
"438","29.729388551","192.168.1.53","185.199.109.154","TCP","66","38992  >  443 [ACK] Seq=611 Ack=4140 Win=40704 Len=0 TSval=3976745970 TSecr=2508103038"
"439","29.739177217","140.82.118.3","192.168.1.53","TLSv1.3","145","Application Data"
"440","29.739200749","140.82.118.3","192.168.1.53","TLSv1.3","145","Application Data"
"441","29.781388099","192.168.1.53","140.82.118.3","TCP","66","43338  >  443 [ACK] Seq=582 Ack=3795 Win=37888 Len=0 TSval=1425041981 TSecr=3493349207"
"442","29.837384545","140.82.118.3","192.168.1.53","TLSv1.3","1458","Application Data"
"443","29.837404808","192.168.1.53","140.82.118.3","TCP","66","43316  >  443 [ACK] Seq=3430 Ack=29213 Win=95488 Len=0 TSval=1425042037 TSecr=2500335122"
"444","29.837426881","140.82.118.3","192.168.1.53","TLSv1.3","1195","Application Data"
"445","29.837433459","192.168.1.53","140.82.118.3","TCP","66","43316  >  443 [ACK] Seq=3430 Ack=30342 Win=98176 Len=0 TSval=1425042037 TSecr=2500335122"
"446","29.837441563","140.82.118.3","192.168.1.53","TLSv1.3","1458","Application Data"
"447","29.837444833","192.168.1.53","140.82.118.3","TCP","66","43316  >  443 [ACK] Seq=3430 Ack=31734 Win=101120 Len=0 TSval=1425042037 TSecr=2500335122"
"448","29.839462907","140.82.118.3","192.168.1.53","TLSv1.3","1474","Application Data"
"449","29.839469205","192.168.1.53","140.82.118.3","TCP","66","43316  >  443 [ACK] Seq=3430 Ack=33142 Win=104064 Len=0 TSval=1425042039 TSecr=2500335122"
"450","29.839478233","140.82.118.3","192.168.1.53","TLSv1.3","1442","Application Data"
"451","29.839481529","192.168.1.53","140.82.118.3","TCP","66","43316  >  443 [ACK] Seq=3430 Ack=34518 Win=106880 Len=0 TSval=1425042039 TSecr=2500335122"
"452","29.839487180","140.82.118.3","192.168.1.53","TLSv1.3","1458","Application Data"
"453","29.839489577","192.168.1.53","140.82.118.3","TCP","66","43316  >  443 [ACK] Seq=3430 Ack=35910 Win=109824 Len=0 TSval=1425042039 TSecr=2500335122"
"454","29.839494628","140.82.118.3","192.168.1.53","TLSv1.3","1474","Application Data"
"455","29.839497708","192.168.1.53","140.82.118.3","TCP","66","43316  >  443 [ACK] Seq=3430 Ack=37318 Win=112640 Len=0 TSval=1425042039 TSecr=2500335122"
"456","29.840080126","140.82.118.3","192.168.1.53","TLSv1.3","1474","Application Data [TCP segment of a reassembled PDU]"
"457","29.840082890","192.168.1.53","140.82.118.3","TCP","66","43316  >  443 [ACK] Seq=3430 Ack=38726 Win=115584 Len=0 TSval=1425042040 TSecr=2500335122"
"458","29.842188713","140.82.118.3","192.168.1.53","TLSv1.3","1474","Application Data [TCP segment of a reassembled PDU]"
"459","29.842210502","192.168.1.53","140.82.118.3","TCP","66","43316  >  443 [ACK] Seq=3430 Ack=40134 Win=118528 Len=0 TSval=1425042042 TSecr=2500335122"
"460","29.842234634","140.82.118.3","192.168.1.53","TLSv1.3","1474","Application Data [TCP segment of a reassembled PDU]"
"461","29.842244098","192.168.1.53","140.82.118.3","TCP","66","43316  >  443 [ACK] Seq=3430 Ack=41542 Win=121344 Len=0 TSval=1425042042 TSecr=2500335122"
"462","29.842253755","140.82.118.3","192.168.1.53","TLSv1.3","1474","Application Data [TCP segment of a reassembled PDU]"
"463","29.842259079","192.168.1.53","140.82.118.3","TCP","66","43316  >  443 [ACK] Seq=3430 Ack=42950 Win=124288 Len=0 TSval=1425042042 TSecr=2500335122"
"464","29.842267228","140.82.118.3","192.168.1.53","TLSv1.3","1474","Application Data [TCP segment of a reassembled PDU]"
"465","29.842272787","192.168.1.53","140.82.118.3","TCP","66","43316  >  443 [ACK] Seq=3430 Ack=44358 Win=127232 Len=0 TSval=1425042042 TSecr=2500335122"
"466","29.842678743","140.82.118.3","192.168.1.53","TLSv1.3","618","Application Data"
"467","29.842694040","192.168.1.53","140.82.118.3","TCP","66","43316  >  443 [ACK] Seq=3430 Ack=44910 Win=130048 Len=0 TSval=1425042043 TSecr=2500335122"
"468","29.973617049","192.168.1.53","192.30.253.124","TLSv1.3","96","Application Data"
"469","29.973739903","192.168.1.53","192.30.253.124","TCP","66","58094  >  443 [FIN, ACK] Seq=1483 Ack=3772 Win=40704 Len=0 TSval=3311728525 TSecr=1060699454"
"470","30.141961686","192.30.253.124","192.168.1.53","TCP","66","443  >  58094 [ACK] Seq=3772 Ack=1483 Win=31744 Len=0 TSval=1060701180 TSecr=3311728525"
"471","30.143346467","192.30.253.124","192.168.1.53","TLSv1.3","92","Application Data"
"472","30.143369134","192.168.1.53","192.30.253.124","TCP","54","58094  >  443 [RST] Seq=1483 Win=0 Len=0"
"473","30.143389799","192.30.253.124","192.168.1.53","TLSv1.3","90","Application Data"
"474","30.143394737","192.168.1.53","192.30.253.124","TCP","54","58094  >  443 [RST] Seq=1483 Win=0 Len=0"
"475","30.143399944","192.30.253.124","192.168.1.53","TCP","66","443  >  58094 [FIN, ACK] Seq=3822 Ack=1483 Win=31744 Len=0 TSval=1060701181 TSecr=3311728525"
"476","30.143402060","192.168.1.53","192.30.253.124","TCP","54","58094  >  443 [RST] Seq=1483 Win=0 Len=0"
"477","30.143406496","192.30.253.124","192.168.1.53","TCP","66","443  >  58094 [ACK] Seq=3823 Ack=1484 Win=31744 Len=0 TSval=1060701181 TSecr=3311728525"
"478","30.143408438","192.168.1.53","192.30.253.124","TCP","54","58094  >  443 [RST] Seq=1484 Win=0 Len=0"
"479","30.385447815","192.168.1.53","173.194.222.102","GQUIC","383","Payload (Encrypted), PKN: 11, CID: 101418421285335142"
"480","30.427190370","173.194.222.102","192.168.1.53","GQUIC","150","Payload (Encrypted), PKN: 13"
"481","30.427264739","173.194.222.102","192.168.1.53","GQUIC","60","Payload (Encrypted), PKN: 14"
"482","30.428198174","192.168.1.53","173.194.222.102","GQUIC","70","Payload (Encrypted), PKN: 12, CID: 101418421285335142"
"483","30.466357359","192.168.1.53","192.168.1.1","DNS","86","Standard query 0x5673 A live.github.com OPT"
"484","30.479826588","192.168.1.1","192.168.1.53","DNS","118","Standard query response 0x5673 A live.github.com A 192.30.253.125 A 192.30.253.124 OPT"
"485","30.480198396","192.168.1.53","192.30.253.125","TCP","74","39962  >  443 [SYN] Seq=0 Win=29200 Len=0 MSS=1460 SACK_PERM=1 TSval=4008544587 TSecr=0 WS=128"
"486","30.535294352","192.168.1.53","34.197.57.23","TLSv1.2","1335","Application Data"
"487","30.541616224","192.168.1.53","192.30.253.116","TLSv1.3","627","Application Data"
"488","30.541717694","192.168.1.53","192.30.253.116","TCP","1474","49988  >  443 [ACK] Seq=11876 Ack=4488 Win=40704 Len=1408 TSval=2109714284 TSecr=3099673817 [TCP segment of a reassembled PDU]"
"489","30.541890936","192.168.1.53","192.30.253.116","TCP","1474","49988  >  443 [ACK] Seq=13284 Ack=4488 Win=40704 Len=1408 TSval=2109714284 TSecr=3099673817 [TCP segment of a reassembled PDU]"
"490","30.542266350","192.168.1.53","192.30.253.116","TCP","1474","49988  >  443 [ACK] Seq=14692 Ack=4488 Win=40704 Len=1408 TSval=2109714284 TSecr=3099673817 [TCP segment of a reassembled PDU]"
"491","30.542725896","192.168.1.53","192.30.253.116","TCP","1474","49988  >  443 [ACK] Seq=16100 Ack=4488 Win=40704 Len=1408 TSval=2109714285 TSecr=3099673817 [TCP segment of a reassembled PDU]"
"492","30.543071185","192.168.1.53","192.30.253.116","TCP","1474","49988  >  443 [ACK] Seq=17508 Ack=4488 Win=40704 Len=1408 TSval=2109714285 TSecr=3099673817 [TCP segment of a reassembled PDU]"
"493","30.543531282","192.168.1.53","192.30.253.116","TCP","1474","49988  >  443 [ACK] Seq=18916 Ack=4488 Win=40704 Len=1408 TSval=2109714286 TSecr=3099673817 [TCP segment of a reassembled PDU]"
"494","30.543978523","192.168.1.53","192.30.253.116","TCP","1474","49988  >  443 [ACK] Seq=20324 Ack=4488 Win=40704 Len=1408 TSval=2109714286 TSecr=3099673817 [TCP segment of a reassembled PDU]"
"495","30.544366863","192.168.1.53","192.30.253.116","TCP","1474","49988  >  443 [ACK] Seq=21732 Ack=4488 Win=40704 Len=1408 TSval=2109714286 TSecr=3099673817 [TCP segment of a reassembled PDU]"
"496","30.544776527","192.168.1.53","192.30.253.116","TLSv1.3","799","Application Data"
"497","30.642935606","192.30.253.125","192.168.1.53","TCP","74","443  >  39962 [SYN, ACK] Seq=0 Ack=1 Win=28480 Len=0 MSS=1436 SACK_PERM=1 TSval=3369180120 TSecr=4008544587 WS=1024"
"498","30.642979984","192.168.1.53","192.30.253.125","TCP","66","39962  >  443 [ACK] Seq=1 Ack=1 Win=29312 Len=0 TSval=4008544750 TSecr=3369180120"
"499","30.643381104","192.168.1.53","192.30.253.125","TLSv1.3","583","Client Hello"
"500","30.690743974","192.30.253.116","192.168.1.53","TCP","66","443  >  49988 [ACK] Seq=4488 Ack=11876 Win=56320 Len=0 TSval=3099675659 TSecr=2109714284"
"501","30.690785749","192.30.253.116","192.168.1.53","TCP","66","443  >  49988 [ACK] Seq=4488 Ack=13284 Win=59392 Len=0 TSval=3099675659 TSecr=2109714284"
"502","30.691540852","192.30.253.116","192.168.1.53","TCP","66","443  >  49988 [ACK] Seq=4488 Ack=14692 Win=62464 Len=0 TSval=3099675659 TSecr=2109714284"
"503","30.691578505","192.30.253.116","192.168.1.53","TCP","66","443  >  49988 [ACK] Seq=4488 Ack=16100 Win=64512 Len=0 TSval=3099675659 TSecr=2109714284"
"504","30.692319207","192.30.253.116","192.168.1.53","TCP","66","443  >  49988 [ACK] Seq=4488 Ack=17508 Win=67584 Len=0 TSval=3099675659 TSecr=2109714285"
"505","30.692356291","192.30.253.116","192.168.1.53","TCP","66","443  >  49988 [ACK] Seq=4488 Ack=18916 Win=70656 Len=0 TSval=3099675659 TSecr=2109714285"
"506","30.694254284","192.30.253.116","192.168.1.53","TCP","66","443  >  49988 [ACK] Seq=4488 Ack=20324 Win=73728 Len=0 TSval=3099675660 TSecr=2109714286"
"507","30.694290654","192.30.253.116","192.168.1.53","TCP","66","443  >  49988 [ACK] Seq=4488 Ack=21732 Win=75776 Len=0 TSval=3099675660 TSecr=2109714286"
"508","30.694307428","192.30.253.116","192.168.1.53","TCP","66","443  >  49988 [ACK] Seq=4488 Ack=23140 Win=78848 Len=0 TSval=3099675660 TSecr=2109714286"
"509","30.694321175","192.30.253.116","192.168.1.53","TCP","66","443  >  49988 [ACK] Seq=4488 Ack=23873 Win=81920 Len=0 TSval=3099675660 TSecr=2109714287"
"510","30.702966287","34.197.57.23","192.168.1.53","TLSv1.2","624","Application Data"
"511","30.703009598","192.168.1.53","34.197.57.23","TCP","66","49100  >  443 [ACK] Seq=4834 Ack=5799 Win=49152 Len=0 TSval=2537991328 TSecr=10951525"
"512","30.787075763","192.30.253.116","192.168.1.53","TLSv1.3","994","Application Data"
"513","30.787093981","192.168.1.53","192.30.253.116","TCP","66","49988  >  443 [ACK] Seq=23873 Ack=5416 Win=42496 Len=0 TSval=2109714529 TSecr=3099675683"
"514","30.804444584","192.30.253.125","192.168.1.53","TLSv1.3","1474","Server Hello, Change Cipher Spec, Application Data"
"515","30.804468958","192.168.1.53","192.30.253.125","TCP","66","39962  >  443 [ACK] Seq=518 Ack=1409 Win=32128 Len=0 TSval=4008544911 TSecr=3369180161"
"516","30.805941108","192.30.253.125","192.168.1.53","TCP","1474","443  >  39962 [ACK] Seq=1409 Ack=518 Win=29696 Len=1408 TSval=3369180161 TSecr=4008544750 [TCP segment of a reassembled PDU]"
"517","30.805952710","192.168.1.53","192.30.253.125","TCP","66","39962  >  443 [ACK] Seq=518 Ack=2817 Win=35072 Len=0 TSval=4008544913 TSecr=3369180161"
"518","30.808585649","192.30.253.125","192.168.1.53","TLSv1.3","636","Application Data, Application Data, Application Data"
"519","30.808596958","192.168.1.53","192.30.253.125","TCP","66","39962  >  443 [ACK] Seq=518 Ack=3387 Win=37888 Len=0 TSval=4008544916 TSecr=3369180161"
"520","30.809865262","192.168.1.53","192.30.253.125","TLSv1.3","130","Change Cipher Spec, Application Data"
"521","30.810180904","192.168.1.53","192.30.253.125","TLSv1.3","870","Application Data"
"522","30.970990908","192.30.253.125","192.168.1.53","TLSv1.3","145","Application Data"
"523","30.971016462","192.30.253.125","192.168.1.53","TLSv1.3","145","Application Data"
"524","30.971021433","192.30.253.125","192.168.1.53","TLSv1.3","293","Application Data"
"525","30.971066395","192.168.1.53","192.30.253.125","TCP","66","39962  >  443 [ACK] Seq=1386 Ack=3772 Win=40704 Len=0 TSval=4008545078 TSecr=3369180202"
"526","30.971594584","192.168.1.53","192.30.253.125","TLSv1.3","133","Application Data"
"527","31.102549366","D-LinkIn_11:1a:74","LiteonTe_5a:c1:b2","ARP","42","Who has 192.168.1.53? Tell 192.168.1.1"
"528","31.102562249","LiteonTe_5a:c1:b2","D-LinkIn_11:1a:74","ARP","42","192.168.1.53 is at 48:d2:24:5a:c1:b2"
"529","31.176473516","192.30.253.125","192.168.1.53","TCP","66","443  >  39962 [ACK] Seq=3772 Ack=1453 Win=31744 Len=0 TSval=3369180254 TSecr=4008545079"
"530","36.007368910","192.168.1.53","192.168.1.1","DNS","100","Standard query 0xa863 A connectivity-check.ubuntu.com OPT"
"531","36.012208539","192.168.1.1","192.168.1.53","DNS","132","Standard query response 0xa863 A connectivity-check.ubuntu.com A 35.224.99.156 A 35.222.85.5 OPT"
"532","36.481295894","192.168.1.53","173.194.73.95","GQUIC","65","Payload (Encrypted), PKN: 8, CID: 15260842709425950555"
"533","36.550711233","173.194.73.95","192.168.1.53","GQUIC","62","Payload (Encrypted), PKN: 9"
"534","37.008223428","192.168.1.53","35.224.99.156","TCP","74","42860  >  80 [SYN] Seq=0 Win=29200 Len=0 MSS=1460 SACK_PERM=1 TSval=152441156 TSecr=0 WS=128"
"535","37.194882550","35.224.99.156","192.168.1.53","TCP","74","80  >  42860 [SYN, ACK] Seq=0 Ack=1 Win=28160 Len=0 MSS=1420 SACK_PERM=1 TSval=953938527 TSecr=152441156 WS=128"
"536","37.194913111","192.168.1.53","35.224.99.156","TCP","66","42860  >  80 [ACK] Seq=1 Ack=1 Win=29312 Len=0 TSval=152441343 TSecr=953938527"
"537","37.195012248","192.168.1.53","35.224.99.156","HTTP","153","GET / HTTP/1.1 "
"538","37.380935657","35.224.99.156","192.168.1.53","TCP","66","80  >  42860 [ACK] Seq=1 Ack=88 Win=26112 Len=0 TSval=953938762 TSecr=152441343"
"539","37.380958880","35.224.99.156","192.168.1.53","HTTP","214","HTTP/1.1 204 No Content "
"540","37.380970471","192.168.1.53","35.224.99.156","TCP","66","42860  >  80 [ACK] Seq=88 Ack=149 Win=30336 Len=0 TSval=152441529 TSecr=953938762"
"541","37.381111955","192.168.1.53","35.224.99.156","TCP","66","42860  >  80 [FIN, ACK] Seq=88 Ack=149 Win=30336 Len=0 TSval=152441529 TSecr=953938762"
"542","37.382564810","35.224.99.156","192.168.1.53","TCP","66","80  >  42860 [FIN, ACK] Seq=149 Ack=88 Win=26112 Len=0 TSval=953938762 TSecr=152441343"
"543","37.382590100","192.168.1.53","35.224.99.156","TCP","66","42860  >  80 [ACK] Seq=89 Ack=150 Win=30336 Len=0 TSval=152441531 TSecr=953938762"
"544","37.570739937","35.224.99.156","192.168.1.53","TCP","66","80  >  42860 [ACK] Seq=150 Ack=89 Win=26112 Len=0 TSval=953938948 TSecr=152441529"
"545","38.825731135","192.168.1.1","224.0.0.1","IGMPv2","42","Membership Query, general"
"546","39.202710041","192.168.1.1","228.8.8.8","IGMPv2","46","Membership Report group 228.8.8.8"
"547","39.232292867","192.168.1.77","224.0.0.252","IGMPv2","60","Membership Report group 224.0.0.252"
"548","39.245098841","192.168.1.77","224.0.0.251","IGMPv2","60","Membership Report group 224.0.0.251"
"549","39.258766543","192.168.1.77","239.255.255.250","IGMPv2","60","Membership Report group 239.255.255.250"
"550","39.593420393","192.168.1.53","224.0.0.251","IGMPv2","46","Membership Report group 224.0.0.251"
"551","39.610446048","192.168.1.53","224.0.0.251","IGMPv2","46","Membership Report group 224.0.0.251"
"552","39.882705304","192.168.1.1","224.0.0.2","IGMPv2","46","Membership Report group 224.0.0.2"
"553","40.808483276","192.168.1.1","239.193.13.49","IGMPv2","42","Membership Query, specific for group 239.193.13.49"
"554","40.872246324","192.168.1.1","239.193.13.49","IGMPv2","42","Membership Query, specific for group 239.193.13.49"
"555","41.013099192","192.168.1.53","64.233.165.198","GQUIC","65","Payload (Encrypted), PKN: 14, CID: 13624842556535870966"
"556","41.087569572","64.233.165.198","192.168.1.53","GQUIC","62","Payload (Encrypted), PKN: 15"
"557","41.730441990","192.168.1.1","239.193.13.49","IGMPv2","42","Membership Query, specific for group 239.193.13.49"
"558","41.996412539","192.168.1.1","239.193.13.49","IGMPv2","42","Membership Query, specific for group 239.193.13.49"
"559","42.712220279","192.168.1.1","239.193.13.49","IGMPv2","42","Membership Query, specific for group 239.193.13.49"
"560","44.008494705","192.168.1.53","64.233.165.198","GQUIC","501","Payload (Encrypted), PKN: 15, CID: 13624842556535870966"
"561","44.058254077","64.233.165.198","192.168.1.53","GQUIC","110","Payload (Encrypted), PKN: 16"
"562","44.058271241","64.233.165.198","192.168.1.53","GQUIC","58","Payload (Encrypted), PKN: 17"
"563","44.058417078","192.168.1.53","64.233.165.198","GQUIC","70","Payload (Encrypted), PKN: 16, CID: 13624842556535870966"
"564","44.478369328","192.168.1.53","173.194.222.102","GQUIC","65","Payload (Encrypted), PKN: 13, CID: 101418421285335142"
"565","44.543530603","173.194.222.102","192.168.1.53","GQUIC","62","Payload (Encrypted), PKN: 15"
"566","44.739902752","140.82.118.3","192.168.1.53","TLSv1.3","90","Application Data"
"567","44.739924905","192.168.1.53","140.82.118.3","TCP","66","43338  >  443 [ACK] Seq=582 Ack=3819 Win=37888 Len=0 TSval=1425056940 TSecr=3493352957"
"568","44.739942871","140.82.118.3","192.168.1.53","TCP","66","443  >  43338 [FIN, ACK] Seq=3819 Ack=582 Win=29696 Len=0 TSval=3493352957 TSecr=1425041981"
"569","44.781436068","192.168.1.53","140.82.118.3","TCP","66","43338  >  443 [ACK] Seq=582 Ack=3820 Win=37888 Len=0 TSval=1425056982 TSecr=3493352957"
